
> vns-masakinihirota@0.8.0 lint:fast U:\2026src\vns-masakinihirota.worktrees\anti
> oxlint --tsconfig ./tsconfig.json --type-aware --type-check ./src


  ! eslint(no-unused-vars): Identifier 'useEffect' is imported but never used.
   ,-[src/app/(protected)/mandala-chart/mandala-chart.tsx:3:10]
 2 | 
 3 | import { useEffect, useState } from "react";
   :          ^^^^|^^^^
   :              `-- 'useEffect' is imported here
 4 | import { Card, CardContent } from "@/components/ui/card";
   `----
  help: Consider removing this import.

  x eslint(no-console): Unexpected console statement.
    ,-[src/components/onboarding/onboarding-form.test.tsx:52:5]
 51 |     fireEvent.change(countrySelect, { target: { value: "その他 (Others)" } });
 52 |     console.log("STEP 2 DONE");
    :     ^^^^^^^^^^^
 53 | 
    `----
  help: Supported methods are: info, warn, error.

  x eslint(no-console): Unexpected console statement.
    ,-[src/components/onboarding/onboarding-form.test.tsx:57:5]
 56 |     // Step 3: Hours
 57 |     console.log("STEP 3 START");
    :     ^^^^^^^^^^^
 58 |     // We need to click "完了"
    `----
  help: Supported methods are: info, warn, error.

  ! eslint(no-unused-vars): Identifier 'Save' is imported but never used.
   ,-[src/components/values/values-list/values-list.tsx:1:33]
 1 | import { Lock, Unlock, Loader2, Save } from "lucide-react";
   :                                 ^^|^
   :                                   `-- 'Save' is imported here
 2 | import React from "react";
   `----
  help: Consider removing this import.

  ! eslint(no-unused-vars): Identifier 'Badge' is imported but never used.
   ,-[src/components/values/values-list/values-list.tsx:4:10]
 3 | // import { Slider } from '@/components/ui/slider'; // Removed as we use native input
 4 | import { Badge } from "@/components/ui/badge";
   :          ^^|^^
   :            `-- 'Badge' is imported here
 5 | import { Button } from "@/components/ui/button";
   `----
  help: Consider removing this import.

  ! eslint(no-unused-vars): Identifier 'CardHeader' is imported but never used.
   ,-[src/components/values/values-list/values-list.tsx:8:3]
 7 |   Card,
 8 |   CardHeader,
   :   ^^^^^|^^^^
   :        `-- 'CardHeader' is imported here
 9 |   CardTitle,
   `----
  help: Consider removing this import.

  ! eslint(no-unused-vars): Identifier 'CardContent' is imported but never used.
    ,-[src/components/values/values-list/values-list.tsx:11:3]
 10 |   CardDescription,
 11 |   CardContent,
    :   ^^^^^|^^^^^
    :        `-- 'CardContent' is imported here
 12 | } from "@/components/ui/card";
    `----
  help: Consider removing this import.

  ! eslint(no-unused-vars): Parameter 'onTagsChange' is declared but never used. Unused parameters should start with a '_'.
    ,-[src/components/work-registration-form/work-registration-form.tsx:46:3]
 45 |   onTierChange,
 46 |   onTagsChange, // Currently unused in view logic but passed if needed for deletions
    :   ^^^^^^|^^^^^
    :         `-- 'onTagsChange' is declared here
 47 |   onNewTagChange,
    `----
  help: Consider removing this parameter.

  ! eslint(no-unused-vars): Parameter 'answer' is declared but never used. Unused parameters should start with a '_'.
    ,-[src/components/values/values-list/values-list.logic.ts:61:3]
 60 | export const saveUserAnswer = async (
 61 |   answer: UserValueAnswer
    :   ^^^|^^
    :      `-- 'answer' is declared here
 62 | ): Promise<boolean> => {
    `----
  help: Consider removing this parameter.

  ! eslint(no-unused-vars): Identifier 'MOCK_USER_ANSWERS' is imported but never used.
   ,-[src/components/values/values-list/values-list.logic.test.ts:4:3]
 3 |   VALUES_QUESTIONS,
 4 |   MOCK_USER_ANSWERS,
   :   ^^^^^^^^|^^^^^^^^
   :           `-- 'MOCK_USER_ANSWERS' is imported here
 5 |   fetchValues,
   `----
  help: Consider removing this import.

  ! eslint(no-unused-vars): Parameter 'table' is declared but never used. Unused parameters should start with a '_'.
     ,-[src/components/user-profiles/user-profile-manager.tsx:108:10]
 107 | const supabase = {
 108 |   from: (table: string) => ({
     :          ^^|^^
     :            `-- 'table' is declared here
 109 |     select: async () => {
     `----
  help: Consider removing this parameter.

  ! eslint(no-unused-vars): Identifier 'Work' is imported but never used.
   ,-[src/components/manual-matching/console/manual-matching-console.logic.ts:1:23]
 1 | import { UserProfile, Work } from "../common/types";
   :                       ^^|^
   :                         `-- 'Work' is imported here
 2 | 
   `----
  help: Consider removing this import.

  ! eslint(no-unused-vars): Identifier 'useState' is imported but never used.
   ,-[src/components/manual-matching/conditions/matching-conditions.logic.ts:1:10]
 1 | import { useState } from "react";
   :          ^^^^|^^^
   :              `-- 'useState' is imported here
 2 | 
   `----
  help: Consider removing this import.

  ! eslint(no-unused-vars): Parameter 'settings' is declared but never used. Unused parameters should start with a '_'.
    ,-[src/components/manual-matching/conditions/matching-conditions.logic.ts:40:3]
 39 | export const saveSettings = async (
 40 |   settings: MatchingSettings
    :   ^^^^|^^^
    :       `-- 'settings' is declared here
 41 | ): Promise<boolean> => {
    `----
  help: Consider removing this parameter.

  ! eslint(no-unused-vars): Parameter 'settings' is declared but never used. Unused parameters should start with a '_'.
    ,-[src/components/manual-matching/conditions/matching-conditions.logic.ts:46:3]
 45 | export const startAutoMatching = async (
 46 |   settings: MatchingSettings
    :   ^^^^|^^^
    :       `-- 'settings' is declared here
 47 | ): Promise<string> => {
    `----
  help: Consider removing this parameter.

  ! eslint(no-unused-vars): Identifier 'Script' is imported but never used.
   ,-[src/app/layout.tsx:4:8]
 3 | import { Geist, Geist_Mono } from "next/font/google";
 4 | import Script from "next/script";
   :        ^^^|^^
   :           `-- 'Script' is imported here
 5 | import { ThemeProvider } from "@/components/theme-provider";
   `----
  help: Consider removing this import.

  ! eslint(no-unused-vars): Identifier 'LucideIcon' is imported but never used.
   ,-[src/components/profile-edited/profile-dashboard/profile-dashboard.logic.ts:1:10]
 1 | import { LucideIcon } from "lucide-react";
   :          ^^^^^|^^^^
   :               `-- 'LucideIcon' is imported here
 2 | 
   `----
  help: Consider removing this import.

  ! eslint(no-unused-vars): Identifier 'MatchRecord' is imported but never used.
   ,-[src/components/manual-matching/console/manual-matching-console.container.tsx:4:23]
 3 | import React, { useState, useEffect, useMemo } from "react";
 4 | import { UserProfile, MatchRecord } from "../common/types";
   :                       ^^^^^|^^^^^
   :                            `-- 'MatchRecord' is imported here
 5 | import { ManualMatchingConsole } from "./manual-matching-console";
   `----
  help: Consider removing this import.

  ! eslint(no-unused-vars): Identifier 'LayoutGrid' is imported but never used.
    ,-[src/components/profile2/profile-dashboard.tsx:14:3]
 13 |   Search,
 14 |   LayoutGrid,
    :   ^^^^^|^^^^
    :        `-- 'LayoutGrid' is imported here
 15 |   List,
    `----
  help: Consider removing this import.

  ! eslint(no-unused-vars): Identifier 'List' is imported but never used.
    ,-[src/components/profile2/profile-dashboard.tsx:15:3]
 14 |   LayoutGrid,
 15 |   List,
    :   ^^|^
    :     `-- 'List' is imported here
 16 |   AlertTriangle,
    `----
  help: Consider removing this import.

  ! eslint(no-unused-vars): Identifier 'UserPlus' is imported but never used.
   ,-[src/components/layout/AppSidebar.tsx:7:3]
 6 |   LogOut,
 7 |   UserPlus,
   :   ^^^^|^^^
   :       `-- 'UserPlus' is imported here
 8 |   ChevronsUpDown,
   `----
  help: Consider removing this import.

  ! eslint(no-unused-vars): Identifier 'fireEvent' is imported but never used.
   ,-[src/components/manual-matching/console/manual-matching-console.test.tsx:1:26]
 1 | import { render, screen, fireEvent } from "@testing-library/react";
   :                          ^^^^|^^^^
   :                              `-- 'fireEvent' is imported here
 2 | import { describe, it, expect, vi } from "vitest";
   `----
  help: Consider removing this import.

  ! eslint(no-unused-vars): Identifier 'ArrowUp' is imported but never used.
    ,-[src/components/matching-manual/matching-settings.tsx:13:3]
 12 |   ArrowDown,
 13 |   ArrowUp,
    :   ^^^|^^^
    :      `-- 'ArrowUp' is imported here
 14 | } from "lucide-react";
    `----
  help: Consider removing this import.

  ! eslint(no-unused-vars): Identifier 'useMemo' is imported but never used.
    ,-[src/components/matching-manual/matching-settings.tsx:15:40]
 14 | } from "lucide-react";
 15 | import React, { useState, useCallback, useMemo } from "react";
    :                                        ^^^|^^^
    :                                           `-- 'useMemo' is imported here
 16 | 
    `----
  help: Consider removing this import.

  ! eslint(no-unused-vars): Catch parameter 'error' is caught but never used. Unused caught errors should start with a '_'.
     ,-[src/components/matching-manual/matching-settings.tsx:219:14]
 218 |       // throw new Error("保存失敗");
 219 |     } catch (error) {
     :              ^^|^^
     :                `-- 'error' is declared here
 220 |       setNotification({
     `----
  help: Consider handling this error.

  ! eslint(no-unused-vars): Catch parameter 'error' is caught but never used. Unused caught errors should start with a '_'.
     ,-[src/components/matching-manual/matching-settings.tsx:262:14]
 261 |       });
 262 |     } catch (error) {
     :              ^^|^^
     :                `-- 'error' is declared here
 263 |       setNotification({
     `----
  help: Consider handling this error.

  ! eslint(no-unused-vars): Parameter 'href' is declared but never used. Unused parameters should start with a '_'.
     ,-[src/components/matching-manual/matching-settings.tsx:458:5]
 457 |     active,
 458 |     href,
     :     ^^|^
     :       `-- 'href' is declared here
 459 |   }: {
     `----
  help: Consider removing this parameter.

  ! eslint(no-unused-vars): Identifier 'redirect' is imported but never used.
   ,-[src/app/(protected)/layout.tsx:1:10]
 1 | import { redirect } from "next/navigation";
   :          ^^^^|^^^
   :              `-- 'redirect' is imported here
 2 | import { AppSidebar } from "@/components/layout/AppSidebar";
   `----
  help: Consider removing this import.

  ! eslint(no-unused-vars): Variable 'user' is declared but never used. Unused variables should start with a '_'.
    ,-[src/app/(protected)/layout.tsx:16:13]
 15 |   const {
 16 |     data: { user },
    :             ^^|^
    :               `-- 'user' is declared here
 17 |     error,
    `----
  help: Consider removing this declaration.

  ! eslint(no-unused-vars): Variable 'error' is declared but never used. Unused variables should start with a '_'.
    ,-[src/app/(protected)/layout.tsx:17:5]
 16 |     data: { user },
 17 |     error,
    :     ^^|^^
    :       `-- 'error' is declared here
 18 |   } = await supabase.auth.getUser();
    `----
  help: Consider removing this declaration.

  ! eslint(no-unused-vars): Identifier 'Shield' is imported but never used.
   ,-[src/components/root-accounts/root-account-dashboard/point-management.tsx:7:3]
 6 |   CalendarClock,
 7 |   Shield,
   :   ^^^|^^
   :      `-- 'Shield' is imported here
 8 |   History,
   `----
  help: Consider removing this import.

  ! eslint(no-unused-vars): Identifier 'Info' is imported but never used.
    ,-[src/components/root-accounts/root-account-dashboard/point-management.tsx:9:3]
  8 |   History,
  9 |   Info,
    :   ^^|^
    :     `-- 'Info' is imported here
 10 | } from "lucide-react";
    `----
  help: Consider removing this import.

  ! eslint(no-unused-vars): Identifier 'LANGUAGE_OPTIONS' is imported but never used.
   ,-[src/components/onboarding-pc/steps/step4-language-pc.test.tsx:3:10]
 2 | import { describe, it, expect, vi } from "vitest";
 3 | import { LANGUAGE_OPTIONS } from "../../onboarding/onboarding.logic";
   :          ^^^^^^^^|^^^^^^^
   :                  `-- 'LANGUAGE_OPTIONS' is imported here
 4 | import { Step4LanguagePC } from "./step4-language-pc";
   `----
  help: Consider removing this import.

  ! eslint(no-unused-vars): Identifier 'CardDescription' is imported but never used.
    ,-[src/components/works/work-list/work-list.tsx:19:3]
 18 |   CardContent,
 19 |   CardDescription,
    :   ^^^^^^^|^^^^^^^
    :          `-- 'CardDescription' is imported here
 20 | } from "@/components/ui/card";
    `----
  help: Consider removing this import.

  ! eslint(no-unused-vars): Identifier 'useEffect' is imported but never used.
   ,-[src/components/mandala-chart/mandala-chart/mandala-chart.tsx:3:10]
 2 | 
 3 | import { useEffect, useState } from "react";
   :          ^^^^|^^^^
   :              `-- 'useEffect' is imported here
 4 | import { Card, CardContent } from "@/components/ui/card";
   `----
  help: Consider removing this import.

  ! eslint(no-unused-vars): Identifier 'vi' is imported but never used.
   ,-[src/components/auto-matching/auto-matching/auto-matching.logic.test.ts:1:32]
 1 | import { describe, it, expect, vi } from "vitest";
   :                                ^|
   :                                 `-- 'vi' is imported here
 2 | import { calculateMatches, SearchCriteria } from "./auto-matching.logic";
   `----
  help: Consider removing this import.

  ! eslint(no-unused-vars): Variable 'results' is declared but never used. Unused variables should start with a '_'.
    ,-[src/components/auto-matching/auto-matching/auto-matching.logic.test.ts:43:11]
 42 | 
 43 |     const results = await calculateMatches(criteria);
    :           ^^^|^^^
    :              `-- 'results' is declared here
 44 |     // c1 (max 800) は条件厳しい
    `----
  help: Consider removing this declaration.

  ! eslint(no-unused-vars): Identifier 'XCircle' is imported but never used.
   ,-[src/components/matching-manual/manual-matching-console.tsx:8:3]
 7 |   CheckCircle2,
 8 |   XCircle,
   :   ^^^|^^^
   :      `-- 'XCircle' is imported here
 9 |   ArrowRightLeft,
   `----
  help: Consider removing this import.

  ! eslint(no-unused-vars): Identifier 'ArrowRightLeft' is imported but never used.
    ,-[src/components/matching-manual/manual-matching-console.tsx:9:3]
  8 |   XCircle,
  9 |   ArrowRightLeft,
    :   ^^^^^^^|^^^^^^
    :          `-- 'ArrowRightLeft' is imported here
 10 |   MoreHorizontal,
    `----
  help: Consider removing this import.

  ! eslint(no-unused-vars): Identifier 'MoreHorizontal' is imported but never used.
    ,-[src/components/matching-manual/manual-matching-console.tsx:10:3]
  9 |   ArrowRightLeft,
 10 |   MoreHorizontal,
    :   ^^^^^^^|^^^^^^
    :          `-- 'MoreHorizontal' is imported here
 11 |   Calendar,
    `----
  help: Consider removing this import.

  ! eslint(no-unused-vars): Identifier 'Calendar' is imported but never used.
    ,-[src/components/matching-manual/manual-matching-console.tsx:11:3]
 10 |   MoreHorizontal,
 11 |   Calendar,
    :   ^^^^|^^^
    :       `-- 'Calendar' is imported here
 12 |   MapPin,
    `----
  help: Consider removing this import.

  ! eslint(no-unused-vars): Identifier 'MapPin' is imported but never used.
    ,-[src/components/matching-manual/manual-matching-console.tsx:12:3]
 11 |   Calendar,
 12 |   MapPin,
    :   ^^^|^^
    :      `-- 'MapPin' is imported here
 13 |   Briefcase,
    `----
  help: Consider removing this import.

  ! eslint(no-unused-vars): Identifier 'Briefcase' is imported but never used.
    ,-[src/components/matching-manual/manual-matching-console.tsx:13:3]
 12 |   MapPin,
 13 |   Briefcase,
    :   ^^^^|^^^^
    :       `-- 'Briefcase' is imported here
 14 |   Heart,
    `----
  help: Consider removing this import.

  ! eslint(no-unused-vars): Identifier 'AlertCircle' is imported but never used.
    ,-[src/components/matching-manual/manual-matching-console.tsx:15:3]
 14 |   Heart,
 15 |   AlertCircle,
    :   ^^^^^|^^^^^
    :        `-- 'AlertCircle' is imported here
 16 |   Moon,
    `----
  help: Consider removing this import.

  ! eslint(no-unused-vars): Identifier 'Check' is imported but never used.
    ,-[src/components/matching-manual/manual-matching-console.tsx:19:3]
 18 |   Loader2,
 19 |   Check,
    :   ^^|^^
    :     `-- 'Check' is imported here
 20 |   BookOpen,
    `----
  help: Consider removing this import.

  ! eslint(no-unused-vars): Type alias 'MatchRecord' is declared but never used.
    ,-[src/components/matching-manual/manual-matching-console.tsx:56:6]
 55 | 
 56 | type MatchRecord = {
    :      ^^^^^|^^^^^
    :           `-- 'MatchRecord' is declared here
 57 |   id: string;
    `----
  help: Consider removing this declaration.

  ! eslint(no-unused-vars): Parameter 'query' is declared but never used. Unused parameters should start with a '_'.
     ,-[src/components/matching-manual/manual-matching-console.tsx:210:22]
 209 |     return {
 210 |       select: async (query: string = "*") => {
     :                      ^^^^^^^^^|^^^^^^^^^
     :                               `-- 'query' is declared here
 211 |         await new Promise((resolve) => setTimeout(resolve, 400));
     `----
  help: Consider removing this parameter.

  ! eslint(no-unused-vars): Identifier 'vi' is imported but never used.
   ,-[src/components/onboarding/onboarding.logic.test.ts:2:32]
 1 | import { renderHook, act } from "@testing-library/react";
 2 | import { describe, it, expect, vi } from "vitest";
   :                                ^|
   :                                 `-- 'vi' is imported here
 3 | import { useOnboarding } from "./onboarding.logic";
   `----
  help: Consider removing this import.

  ! eslint(no-unused-vars): Identifier 'useEffect' is imported but never used.
   ,-[src/components/onboarding-pc/steps/step2-hours-pc.tsx:3:27]
 2 | import { AlertCircle, Plus, Trash2 } from "lucide-react";
 3 | import React, { useState, useEffect } from "react";
   :                           ^^^^|^^^^
   :                               `-- 'useEffect' is imported here
 4 | import { timeToHours, hoursToTime } from "@/lib/root-account-utils";
   `----
  help: Consider removing this import.

  x eslint(no-console): Unexpected console statement.
    ,-[src/components/onboarding/onboarding-form.tsx:27:7]
 26 |       // TODO: Call API to create root account
 27 |       console.log("Submitting data:", formData);
    :       ^^^^^^^^^^^
 28 |       // Simulate API call
    `----
  help: Supported methods are: info, warn, error.

  ! eslint(no-unused-vars): Identifier 'Languages' is imported but never used.
   ,-[src/components/onboarding-pc/steps/step4-language-pc.tsx:1:10]
 1 | import { Languages, Globe, Bot, User } from "lucide-react";
   :          ^^^^|^^^^
   :              `-- 'Languages' is imported here
 2 | import React from "react";
   `----
  help: Consider removing this import.

  ! eslint(no-unused-vars): Identifier 'Separator' is imported but never used.
    ,-[src/components/manual-matching/conditions/matching-conditions.tsx:14:10]
 13 | } from "@/components/ui/select";
 14 | import { Separator } from "@/components/ui/separator";
    :          ^^^^|^^^^
    :              `-- 'Separator' is imported here
 15 | import {
    `----
  help: Consider removing this import.

  ! eslint(no-unused-vars): Identifier 'CreditCard' is imported but never used.
    ,-[src/components/root-accounts/root-account-dashboard/root-account-dashboard.tsx:12:3]
 11 |   Save,
 12 |   CreditCard,
    :   ^^^^^|^^^^
    :        `-- 'CreditCard' is imported here
 13 |   AlertCircle,
    `----
  help: Consider removing this import.

  ! eslint(no-unused-vars): Identifier 'Gift' is imported but never used.
    ,-[src/components/root-accounts/root-account-dashboard/root-account-dashboard.tsx:23:3]
 22 |   Crown,
 23 |   Gift,
    :   ^^|^
    :     `-- 'Gift' is imported here
 24 | } from "lucide-react";
    `----
  help: Consider removing this import.

  ! eslint(no-unused-vars): Identifier 'CONSTELLATIONS' is imported but never used.
    ,-[src/components/root-accounts/root-account-dashboard/root-account-dashboard.tsx:28:3]
 27 | import {
 28 |   CONSTELLATIONS,
    :   ^^^^^^^|^^^^^^
    :          `-- 'CONSTELLATIONS' is imported here
 29 |   generateAnonymousName,
    `----
  help: Consider removing this import.

  ! eslint(no-unused-vars): Identifier 'generateAnonymousName' is imported but never used.
    ,-[src/components/root-accounts/root-account-dashboard/root-account-dashboard.tsx:29:3]
 28 |   CONSTELLATIONS,
 29 |   generateAnonymousName,
    :   ^^^^^^^^^^|^^^^^^^^^^
    :             `-- 'generateAnonymousName' is imported here
 30 |   getZodiacSymbol,
    `----
  help: Consider removing this import.

  ! eslint(no-unused-vars): Identifier 'Award' is imported but never used.
    ,-[src/components/root-accounts/root-account-dashboard/root-account-dashboard.tsx:46:3]
 45 |   UserProfileSummary,
 46 |   Award,
    :   ^^|^^
    :     `-- 'Award' is imported here
 47 | } from "./root-account-dashboard.types";
    `----
  help: Consider removing this import.

  ! eslint(no-unused-vars): Variable 'handleCancel' is declared but never used. Unused variables should start with a '_'.
     ,-[src/components/root-accounts/root-account-dashboard/root-account-dashboard.tsx:161:9]
 160 | 
 161 |   const handleCancel = () => {
     :         ^^^^^^|^^^^^
     :               `-- 'handleCancel' is declared here
 162 |     setFormData(originalData);
     `----
  help: Consider removing this declaration.

Found 55 warnings and 3 errors.
Finished in 3.6s on 251 files using 12 threads.
 ELIFECYCLE  Command failed with exit code 1.
